{
  "$schema": "http://json-schema.org/draft-07/schema#",
  "title": "ProjectContext",
  "description": "Full context for a single project, including evidence chunks. Produced by Task 1 (ingestion).",
  "type": "object",
  "required": ["project_id", "project_name", "input_quality", "needs_student_input", "evidence_chunks"],
  "properties": {
    "project_id": {
      "type": "string"
    },
    "project_name": {
      "type": "string"
    },
    "input_quality": {
      "type": "string",
      "enum": ["ok", "thin", "missing"],
      "description": "ok = enough info for questions; thin = marginal; missing = no usable info."
    },
    "needs_student_input": {
      "type": "boolean",
      "description": "True if the student should paste README details before good questions can be generated."
    },
    "evidence_chunks": {
      "type": "array",
      "items": { "$ref": "evidence_chunk.schema.json" }
    }
  },
  "additionalProperties": false
}